{
  "id": "stb-videocon-d2h",
  "brand": "d2h",
  "category": "SET_TOP_BOX",
  "model": "Videocon d2h HD / 4K",
  "region": "India",
  "version": "1.0.0",
  "supported_transports": ["IR"],
  "ir_config": {
    "protocol": "NEC",
    "carrier_frequency_hz": 38000,
    "customer_code": "0x00BF"
  },
  "commands": {
    "POWER": { "label": "Power", "ir_hex": "0x00BF48B7" },
    "VOLUME_UP": { "label": "Volume +", "ir_hex": "0x00BF08F7" },
    "VOLUME_DOWN": { "label": "Volume -", "ir_hex": "0x00BF8877" },
    "MUTE": { "label": "Mute", "ir_hex": "0x00BF7887" },
    "CHANNEL_UP": { "label": "Channel +", "ir_hex": "0x00BF28D7" },
    "CHANNEL_DOWN": { "label": "Channel -", "ir_hex": "0x00BFA857" },
    "GUIDE": { "label": "Active / Guide", "ir_hex": "0x00BF6897" },
    "MENU": { "label": "Menu", "ir_hex": "0x00BFE817" },
    "DPAD_UP": { "label": "Up", "ir_hex": "0x00BF18E7" },
    "DPAD_DOWN": { "label": "Down", "ir_hex": "0x00BF9867" },
    "DPAD_LEFT": { "label": "Left", "ir_hex": "0x00BF58A7" },
    "DPAD_RIGHT": { "label": "Right", "ir_hex": "0x00BFD827" },
    "DPAD_OK": { "label": "OK", "ir_hex": "0x00BF38C7" },
    "COLOR_RED": { "label": "Red", "ir_hex": "0x00BFB847" },
    "COLOR_GREEN": { "label": "Green", "ir_hex": "0x00BF7887" },
    "COLOR_YELLOW": { "label": "Yellow", "ir_hex": "0x00BFF807" },
    "COLOR_BLUE": { "label": "Blue", "ir_hex": "0x00BF20DF" }
  }
}
