{
  "id": "tv-xiaomi-patchwall",
  "brand": "Xiaomi",
  "category": "TV",
  "model": "Mi TV / Redmi TV (PatchWall / Android TV)",
  "region": "India",
  "version": "1.0.0",
  "supported_transports": ["WIFI", "BLUETOOTH", "IR"],
  "ir_config": {
    "protocol": "NEC",
    "carrier_frequency_hz": 38000,
    "customer_code": "0x0A"
  },
  "wifi_config": {
    "adapter": "android_tv",
    "default_port": 6466,
    "auth_required": true,
    "auth_type": "PIN",
    "discovery_service": "_androidtvremote2._tcp.local"
  },
  "bluetooth_config": {
    "service_uuid": "00001812-0000-1000-8000-00805f9b34fb",
    "write_characteristic_uuid": "00002a4d-0000-1000-8000-00805f9b34fb"
  },
  "commands": {
    "POWER": { "label": "Power", "ir_hex": "0x0AF510EF", "wifi_payload": { "key_code": 26 } },
    "VOLUME_UP": { "label": "Volume +", "ir_hex": "0x0AF520DF", "wifi_payload": { "key_code": 24 } },
    "VOLUME_DOWN": { "label": "Volume -", "ir_hex": "0x0AF530CF", "wifi_payload": { "key_code": 25 } },
    "MUTE": { "label": "Mute", "ir_hex": "0x0AF540BF", "wifi_payload": { "key_code": 164 } },
    "DPAD_UP": { "label": "Up", "ir_hex": "0x0AF550AF", "wifi_payload": { "key_code": 19 } },
    "DPAD_DOWN": { "label": "Down", "ir_hex": "0x0AF5609F", "wifi_payload": { "key_code": 20 } },
    "DPAD_LEFT": { "label": "Left", "ir_hex": "0x0AF5708F", "wifi_payload": { "key_code": 21 } },
    "DPAD_RIGHT": { "label": "Right", "ir_hex": "0x0AF5807F", "wifi_payload": { "key_code": 22 } },
    "DPAD_OK": { "label": "OK", "ir_hex": "0x0AF5906F", "wifi_payload": { "key_code": 23 } },
    "BACK": { "label": "Back", "ir_hex": "0x0AF5A05F", "wifi_payload": { "key_code": 4 } },
    "HOME": { "label": "Home", "ir_hex": "0x0AF5B04F", "wifi_payload": { "key_code": 3 } },
    "PATCHWALL": { "label": "PatchWall", "wifi_payload": { "key_code": 170 } },
    "NETFLIX": { "label": "Netflix", "wifi_payload": { "app_package": "com.netflix.ninja" } },
    "PRIME_VIDEO": { "label": "Prime Video", "wifi_payload": { "app_package": "com.amazon.amazonvideo.livingroom" } }
  }
}
