{
  "id": "stb-jio-fiber",
  "brand": "Jio",
  "category": "SET_TOP_BOX",
  "model": "JioFiber 4K Set-Top Box (Hybrid IR / IP)",
  "region": "India",
  "version": "1.0.0",
  "supported_transports": ["IR", "WIFI", "BLUETOOTH"],
  "ir_config": {
    "protocol": "NEC",
    "carrier_frequency_hz": 38000,
    "customer_code": "0x00FF"
  },
  "wifi_config": {
    "adapter": "android_tv",
    "default_port": 5555,
    "auth_required": false
  },
  "commands": {
    "POWER": { "label": "Power", "ir_hex": "0x00FF02FD", "wifi_payload": { "key": "KEY_POWER" } },
    "VOLUME_UP": { "label": "Volume +", "ir_hex": "0x00FF0EF1", "wifi_payload": { "key": "KEY_VOLUMEUP" } },
    "VOLUME_DOWN": { "label": "Volume -", "ir_hex": "0x00FF12ED", "wifi_payload": { "key": "KEY_VOLUMEDOWN" } },
    "MUTE": { "label": "Mute", "ir_hex": "0x00FF10EF", "wifi_payload": { "key": "KEY_MUTE" } },
    "CHANNEL_UP": { "label": "Channel +", "ir_hex": "0x00FF18E7", "wifi_payload": { "key": "KEY_CHANNELUP" } },
    "CHANNEL_DOWN": { "label": "Channel -", "ir_hex": "0x00FF1CE3", "wifi_payload": { "key": "KEY_CHANNELDOWN" } },
    "GUIDE": { "label": "Guide", "ir_hex": "0x00FF48B7", "wifi_payload": { "key": "KEY_EPG" } },
    "INFO": { "label": "Info", "ir_hex": "0x00FF40BF", "wifi_payload": { "key": "KEY_INFO" } },
    "MENU": { "label": "Menu", "ir_hex": "0x00FF50AF", "wifi_payload": { "key": "KEY_MENU" } },
    "HOME": { "label": "Home", "ir_hex": "0x00FF4CB3", "wifi_payload": { "key": "KEY_HOME" } },
    "BACK": { "label": "Back", "ir_hex": "0x00FF52AD", "wifi_payload": { "key": "KEY_BACK" } },
    "EXIT": { "label": "Exit", "ir_hex": "0x00FF54AB", "wifi_payload": { "key": "KEY_EXIT" } },
    "DPAD_UP": { "label": "Up", "ir_hex": "0x00FF08F7", "wifi_payload": { "key": "KEY_UP" } },
    "DPAD_DOWN": { "label": "Down", "ir_hex": "0x00FF04FB", "wifi_payload": { "key": "KEY_DOWN" } },
    "DPAD_LEFT": { "label": "Left", "ir_hex": "0x00FF06F9", "wifi_payload": { "key": "KEY_LEFT" } },
    "DPAD_RIGHT": { "label": "Right", "ir_hex": "0x00FF0AF5", "wifi_payload": { "key": "KEY_RIGHT" } },
    "DPAD_OK": { "label": "Select", "ir_hex": "0x00FF00FF", "wifi_payload": { "key": "KEY_ENTER" } },
    "VOICE": { "label": "Voice Assistant", "wifi_payload": { "key": "KEY_VOICE_SEARCH" } },
    "JIOCINEMA": { "label": "JioCinema", "wifi_payload": { "app_id": "com.jio.media.ondemand" } },
    "JIOSAAVN": { "label": "JioSaavn", "wifi_payload": { "app_id": "com.jio.media.jiobeats" } },
    "YOUTUBE": { "label": "YouTube", "wifi_payload": { "app_id": "com.google.android.youtube.tv" } },
    "HOTSTAR": { "label": "Disney+ Hotstar", "wifi_payload": { "app_id": "in.startv.hotstar" } },
    "COLOR_RED": { "label": "Red", "ir_hex": "0x00FF906F" },
    "COLOR_GREEN": { "label": "Green", "ir_hex": "0x00FF926D" },
    "COLOR_YELLOW": { "label": "Yellow", "ir_hex": "0x00FF946B" },
    "COLOR_BLUE": { "label": "Blue", "ir_hex": "0x00FF9669" },
    "NUM_0": { "label": "0", "ir_hex": "0x00FF20DF", "wifi_payload": { "key": "KEY_0" } },
    "NUM_1": { "label": "1", "ir_hex": "0x00FF22DD", "wifi_payload": { "key": "KEY_1" } },
    "NUM_2": { "label": "2", "ir_hex": "0x00FF24DB", "wifi_payload": { "key": "KEY_2" } },
    "NUM_3": { "label": "3", "ir_hex": "0x00FF26D9", "wifi_payload": { "key": "KEY_3" } },
    "NUM_4": { "label": "4", "ir_hex": "0x00FF28D7", "wifi_payload": { "key": "KEY_4" } },
    "NUM_5": { "label": "5", "ir_hex": "0x00FF2AD5", "wifi_payload": { "key": "KEY_5" } },
    "NUM_6": { "label": "6", "ir_hex": "0x00FF2CD3", "wifi_payload": { "key": "KEY_6" } },
    "NUM_7": { "label": "7", "ir_hex": "0x00FF2ED1", "wifi_payload": { "key": "KEY_7" } },
    "NUM_8": { "label": "8", "ir_hex": "0x00FF30CF", "wifi_payload": { "key": "KEY_8" } },
    "NUM_9": { "label": "9", "ir_hex": "0x00FF32CD", "wifi_payload": { "key": "KEY_9" } }
  }
}
