{
  "id": "stb-tata-play",
  "brand": "Tata Play",
  "category": "SET_TOP_BOX",
  "model": "HD / Binge+ / SD Set-Top Box",
  "region": "India",
  "version": "1.0.0",
  "supported_transports": ["IR"],
  "ir_config": {
    "protocol": "NEC",
    "carrier_frequency_hz": 38000,
    "customer_code": "0x00BF"
  },
  "commands": {
    "POWER": { "label": "Power", "ir_hex": "0x00BF02FD" },
    "VOLUME_UP": { "label": "Volume +", "ir_hex": "0x00BF0EF1" },
    "VOLUME_DOWN": { "label": "Volume -", "ir_hex": "0x00BF12ED" },
    "MUTE": { "label": "Mute", "ir_hex": "0x00BF10EF" },
    "CHANNEL_UP": { "label": "Channel +", "ir_hex": "0x00BF18E7" },
    "CHANNEL_DOWN": { "label": "Channel -", "ir_hex": "0x00BF1CE3" },
    "GUIDE": { "label": "Guide", "ir_hex": "0x00BF48B7" },
    "PLAN_INFO": { "label": "Info", "ir_hex": "0x00BF40BF" },
    "MENU": { "label": "Organiser", "ir_hex": "0x00BF50AF" },
    "HOME": { "label": "Home", "ir_hex": "0x00BF4CB3" },
    "BACK": { "label": "Back", "ir_hex": "0x00BF52AD" },
    "EXIT": { "label": "Exit", "ir_hex": "0x00BF54AB" },
    "DPAD_UP": { "label": "Up", "ir_hex": "0x00BF08F7" },
    "DPAD_DOWN": { "label": "Down", "ir_hex": "0x00BF04FB" },
    "DPAD_LEFT": { "label": "Left", "ir_hex": "0x00BF06F9" },
    "DPAD_RIGHT": { "label": "Right", "ir_hex": "0x00BF0AF5" },
    "DPAD_OK": { "label": "Select", "ir_hex": "0x00BF00FF" },
    "FAVORITE": { "label": "Fav", "ir_hex": "0x00BF609F" },
    "RECORD": { "label": "Record", "ir_hex": "0x00BF807F" },
    "PLAY": { "label": "Play", "ir_hex": "0x00BF827D" },
    "PAUSE": { "label": "Pause", "ir_hex": "0x00BF847B" },
    "STOP": { "label": "Stop", "ir_hex": "0x00BF8679" },
    "REWIND": { "label": "Rewind", "ir_hex": "0x00BF8877" },
    "FAST_FORWARD": { "label": "Fast Forward", "ir_hex": "0x00BF8A75" },
    "COLOR_RED": { "label": "Red", "ir_hex": "0x00BF906F" },
    "COLOR_GREEN": { "label": "Green", "ir_hex": "0x00BF926D" },
    "COLOR_YELLOW": { "label": "Yellow", "ir_hex": "0x00BF946B" },
    "COLOR_BLUE": { "label": "Blue", "ir_hex": "0x00BF9669" },
    "NUM_0": { "label": "0", "ir_hex": "0x00BF20DF" },
    "NUM_1": { "label": "1", "ir_hex": "0x00BF22DD" },
    "NUM_2": { "label": "2", "ir_hex": "0x00BF24DB" },
    "NUM_3": { "label": "3", "ir_hex": "0x00BF26D9" },
    "NUM_4": { "label": "4", "ir_hex": "0x00BF28D7" },
    "NUM_5": { "label": "5", "ir_hex": "0x00BF2AD5" },
    "NUM_6": { "label": "6", "ir_hex": "0x00BF2CD3" },
    "NUM_7": { "label": "7", "ir_hex": "0x00BF2ED1" },
    "NUM_8": { "label": "8", "ir_hex": "0x00BF30CF" },
    "NUM_9": { "label": "9", "ir_hex": "0x00BF32CD" }
  }
}
