{
  "id": "tv-generic-ir",
  "brand": "Generic",
  "category": "TV",
  "model": "Standard Indian CRT & LED TV (Onida / Micromax / Lloyd / Videocon)",
  "region": "India",
  "version": "1.0.0",
  "supported_transports": ["IR"],
  "ir_config": {
    "protocol": "NEC",
    "carrier_frequency_hz": 38000,
    "customer_code": "0x00FF"
  },
  "commands": {
    "POWER": { "label": "Power", "ir_hex": "0x00FFA25D" },
    "VOLUME_UP": { "label": "Volume +", "ir_hex": "0x00FF629D" },
    "VOLUME_DOWN": { "label": "Volume -", "ir_hex": "0x00FFA857" },
    "MUTE": { "label": "Mute", "ir_hex": "0x00FFE21D" },
    "CHANNEL_UP": { "label": "Channel +", "ir_hex": "0x00FF02FD" },
    "CHANNEL_DOWN": { "label": "Channel -", "ir_hex": "0x00FF9867" },
    "DPAD_UP": { "label": "Up", "ir_hex": "0x00FF6897" },
    "DPAD_DOWN": { "label": "Down", "ir_hex": "0x00FF906F" },
    "DPAD_LEFT": { "label": "Left", "ir_hex": "0x00FF30CF" },
    "DPAD_RIGHT": { "label": "Right", "ir_hex": "0x00FFB04F" },
    "DPAD_OK": { "label": "OK", "ir_hex": "0x00FF708F" },
    "MENU": { "label": "Menu", "ir_hex": "0x00FFE01F" },
    "SOURCE": { "label": "AV/Input", "ir_hex": "0x00FFD22D" },
    "NUM_0": { "label": "0", "ir_hex": "0x00FF00FF" },
    "NUM_1": { "label": "1", "ir_hex": "0x00FF807F" },
    "NUM_2": { "label": "2", "ir_hex": "0x00FF40BF" },
    "NUM_3": { "label": "3", "ir_hex": "0x00FFC03F" },
    "NUM_4": { "label": "4", "ir_hex": "0x00FF20DF" },
    "NUM_5": { "label": "5", "ir_hex": "0x00FFA05F" },
    "NUM_6": { "label": "6", "ir_hex": "0x00FF609F" },
    "NUM_7": { "label": "7", "ir_hex": "0x00FFE01F" },
    "NUM_8": { "label": "8", "ir_hex": "0x00FF10EF" },
    "NUM_9": { "label": "9", "ir_hex": "0x00FF906F" }
  }
}
