{
  "id": "tv-samsung-smart",
  "brand": "Samsung",
  "category": "TV",
  "model": "Smart TV (Tizen / IR Hybrid)",
  "region": "Global",
  "version": "1.0.0",
  "supported_transports": ["WIFI", "IR"],
  "ir_config": {
    "protocol": "SAMSUNG",
    "carrier_frequency_hz": 38000,
    "customer_code": "0xE0E0"
  },
  "wifi_config": {
    "adapter": "samsung_tizen",
    "default_port": 8002,
    "auth_required": true,
    "auth_type": "TOKEN",
    "discovery_service": "urn:samsung.com:device:RemoteControlReceiver:1"
  },
  "commands": {
    "POWER": { "label": "Power", "ir_hex": "0xE0E040BF", "wifi_payload": { "key": "KEY_POWER" } },
    "VOLUME_UP": { "label": "Volume +", "ir_hex": "0xE0E0E01F", "wifi_payload": { "key": "KEY_VOLUP" } },
    "VOLUME_DOWN": { "label": "Volume -", "ir_hex": "0xE0E0D02F", "wifi_payload": { "key": "KEY_VOLDOWN" } },
    "MUTE": { "label": "Mute", "ir_hex": "0xE0E0F00F", "wifi_payload": { "key": "KEY_MUTE" } },
    "CHANNEL_UP": { "label": "Channel +", "ir_hex": "0xE0E048B7", "wifi_payload": { "key": "KEY_CHUP" } },
    "CHANNEL_DOWN": { "label": "Channel -", "ir_hex": "0xE0E008F7", "wifi_payload": { "key": "KEY_CHDOWN" } },
    "DPAD_UP": { "label": "Up", "ir_hex": "0xE0E006F9", "wifi_payload": { "key": "KEY_UP" } },
    "DPAD_DOWN": { "label": "Down", "ir_hex": "0xE0E08679", "wifi_payload": { "key": "KEY_DOWN" } },
    "DPAD_LEFT": { "label": "Left", "ir_hex": "0xE0E0A659", "wifi_payload": { "key": "KEY_LEFT" } },
    "DPAD_RIGHT": { "label": "Right", "ir_hex": "0xE0E046B9", "wifi_payload": { "key": "KEY_RIGHT" } },
    "DPAD_OK": { "label": "OK", "ir_hex": "0xE0E016E9", "wifi_payload": { "key": "KEY_ENTER" } },
    "HOME": { "label": "Home", "ir_hex": "0xE0E09E61", "wifi_payload": { "key": "KEY_HOME" } },
    "BACK": { "label": "Back", "ir_hex": "0xE0E01AE5", "wifi_payload": { "key": "KEY_RETURN" } },
    "SOURCE": { "label": "Source", "ir_hex": "0xE0E0807F", "wifi_payload": { "key": "KEY_SOURCE" } },
    "MENU": { "label": "Menu", "ir_hex": "0xE0E058A7", "wifi_payload": { "key": "KEY_MENU" } },
    "EXIT": { "label": "Exit", "ir_hex": "0xE0E0B44B", "wifi_payload": { "key": "KEY_EXIT" } },
    "INFO": { "label": "Info", "ir_hex": "0xE0E0F807", "wifi_payload": { "key": "KEY_INFO" } },
    "NETFLIX": { "label": "Netflix", "wifi_payload": { "app_id": "3201512006785" } },
    "YOUTUBE": { "label": "YouTube", "wifi_payload": { "app_id": "111299001912" } },
    "PRIME_VIDEO": { "label": "Prime Video", "wifi_payload": { "app_id": "3201512006963" } },
    "NUM_0": { "label": "0", "ir_hex": "0xE0E08877", "wifi_payload": { "key": "KEY_0" } },
    "NUM_1": { "label": "1", "ir_hex": "0xE0E020DF", "wifi_payload": { "key": "KEY_1" } },
    "NUM_2": { "label": "2", "ir_hex": "0xE0E0A05F", "wifi_payload": { "key": "KEY_2" } },
    "NUM_3": { "label": "3", "ir_hex": "0xE0E0609F", "wifi_payload": { "key": "KEY_3" } },
    "NUM_4": { "label": "4", "ir_hex": "0xE0E010EF", "wifi_payload": { "key": "KEY_4" } },
    "NUM_5": { "label": "5", "ir_hex": "0xE0E0906F", "wifi_payload": { "key": "KEY_5" } },
    "NUM_6": { "label": "6", "ir_hex": "0xE0E050AF", "wifi_payload": { "key": "KEY_6" } },
    "NUM_7": { "label": "7", "ir_hex": "0xE0E030CF", "wifi_payload": { "key": "KEY_7" } },
    "NUM_8": { "label": "8", "ir_hex": "0xE0E0B04F", "wifi_payload": { "key": "KEY_8" } },
    "NUM_9": { "label": "9", "ir_hex": "0xE0E0708F", "wifi_payload": { "key": "KEY_9" } }
  }
}
