{
  "id": "stb-dd-free-dish",
  "brand": "DD Free Dish",
  "category": "SET_TOP_BOX",
  "model": "MPEG-2 / MPEG-4 Free-to-Air STB (Solid / Melbon / Catvision)",
  "region": "India",
  "version": "1.0.0",
  "supported_transports": ["IR"],
  "ir_config": {
    "protocol": "NEC",
    "carrier_frequency_hz": 38000,
    "customer_code": "0x00FF"
  },
  "commands": {
    "POWER": { "label": "Power", "ir_hex": "0x00FFA25D" },
    "VOLUME_UP": { "label": "Volume +", "ir_hex": "0x00FF629D" },
    "VOLUME_DOWN": { "label": "Volume -", "ir_hex": "0x00FFA857" },
    "MUTE": { "label": "Mute", "ir_hex": "0x00FFE21D" },
    "CHANNEL_UP": { "label": "Channel +", "ir_hex": "0x00FF02FD" },
    "CHANNEL_DOWN": { "label": "Channel -", "ir_hex": "0x00FF9867" },
    "MENU": { "label": "Menu", "ir_hex": "0x00FFE01F" },
    "EXIT": { "label": "Exit", "ir_hex": "0x00FF7A85" },
    "DPAD_UP": { "label": "Up", "ir_hex": "0x00FF6897" },
    "DPAD_DOWN": { "label": "Down", "ir_hex": "0x00FF906F" },
    "DPAD_LEFT": { "label": "Left", "ir_hex": "0x00FF30CF" },
    "DPAD_RIGHT": { "label": "Right", "ir_hex": "0x00FFB04F" },
    "DPAD_OK": { "label": "OK", "ir_hex": "0x00FF708F" },
    "TV_RADIO": { "label": "TV/Radio", "ir_hex": "0x00FF18E7" }
  }
}
