{
  "id": "stb-gtpl-cable",
  "brand": "GTPL",
  "category": "SET_TOP_BOX",
  "model": "GTPL KCBPL Digital Cable STB",
  "region": "India",
  "version": "1.0.0",
  "supported_transports": ["IR"],
  "ir_config": {
    "protocol": "NEC",
    "carrier_frequency_hz": 38000,
    "customer_code": "0x00FE"
  },
  "commands": {
    "POWER": { "label": "Power", "ir_hex": "0x00FE48B7" },
    "VOLUME_UP": { "label": "Volume +", "ir_hex": "0x00FE58A7" },
    "VOLUME_DOWN": { "label": "Volume -", "ir_hex": "0x00FE7887" },
    "MUTE": { "label": "Mute", "ir_hex": "0x00FE08F7" },
    "CHANNEL_UP": { "label": "Channel +", "ir_hex": "0x00FE20DF" },
    "CHANNEL_DOWN": { "label": "Channel -", "ir_hex": "0x00FEA05F" },
    "GUIDE": { "label": "Guide", "ir_hex": "0x00FE609F" },
    "MENU": { "label": "Menu", "ir_hex": "0x00FEE01F" },
    "DPAD_UP": { "label": "Up", "ir_hex": "0x00FE10EF" },
    "DPAD_DOWN": { "label": "Down", "ir_hex": "0x00FE906F" },
    "DPAD_LEFT": { "label": "Left", "ir_hex": "0x00FEB04F" },
    "DPAD_RIGHT": { "label": "Right", "ir_hex": "0x00FE30CF" },
    "DPAD_OK": { "label": "OK", "ir_hex": "0x00FED02F" }
  }
}
